{
  "schema_version": "1.0",
  "evidence_id": "018f6c50-9c99-7b03-2d3e-6f4a5b6c7d90",
  "claim_id": "018f6c40-8b88-7a02-1c2d-5e3f4a5b6c89",
  "source_id": "018f6c20-5e55-7701-8f9a-2b0c1d3e4f56",
  "direction": "support",
  "locator": { "section": "3.2", "quote": "the transmon design suppresses charge dispersion exponentially" },
  "extraction_method": "ai",
  "retrieved_at": "2026-01-15T09:12:00Z"
}
